[
  {
    "event_id": "EVT-001",
    "is_mock": true,
    "project_id": "PRJ-001",
    "event_type": "approved_or_filed",
    "event_date": "2025-03-15",
    "knowledge_status": "known",
    "evidence_ids": [
      "EVD-002"
    ],
    "human_review_status": "confirmed"
  },
  {
    "event_id": "EVT-002",
    "is_mock": true,
    "project_id": "PRJ-001",
    "event_type": "construction_started",
    "event_date": "2025-04-01",
    "knowledge_status": "pending_confirmation",
    "evidence_ids": [
      "EVD-009"
    ],
    "human_review_status": "review_required"
  },
  {
    "event_id": "EVT-003",
    "is_mock": true,
    "project_id": "PRJ-002",
    "event_type": "construction_started",
    "knowledge_status": "pending_confirmation",
    "evidence_ids": [
      "EVD-008"
    ],
    "human_review_status": "review_required"
  },
  {
    "event_id": "EVT-004",
    "is_mock": true,
    "project_id": "PRJ-002",
    "event_type": "full_operation",
    "knowledge_status": "unknown",
    "evidence_ids": [],
    "human_review_status": "unreviewed"
  }
]
